번호,문제,보기1,보기2,보기3,보기4,정답,타입,이미지
1,"도전도 k=6×1017℧m, 투자율 인 평면도체 표면에 10kHz의 전류가 흐를 때, 침투깊이 δ(m) 은?",,,,,1,image,C:\전기CBT\out_img\전기기사20190804(교사용)_p08_q001.png
2,최대로 되는 변압기의 권수비 a는?,√5,√10,5,10,2,image,C:\전기CBT\out_img\전기기사20190804(교사용)_p08_q002.png
3,"송전선의 전류가 0.01초 사이에 10kA 변화될 때 이 송전선 에 나란한 통신선에 유도되는 유도 전압은 몇 V인가? (단, 송전선과 통신선 간의 상호유도계수는 0.3mH이다.)",30,300,3000,30000,2,text,
4,단면적 15cm2의 자석 근처에 같은 단면적을 가진 철편을 놓을 때 그 곳을 통하는 자속이 3×10-4Wb이면 철편에 작 용하는 흡인력은 약 몇 N 인가?,12.2,23.9,36.6,48.8,2,text,
5,"단면적이 s(m2), 단위 길이에 대한 권수가 n(회/m)인 무한 히 긴 솔레노이드의 단위 길이당 자기인덕턴스(H/m)는?",μ·s·n,μ·s·n2,μ·s2·n,μ·s2·n2,2,text,
6,다음 금속 중 저항률이 가장 작은 것은?,은,철,백금,알루미늄,1,image,C:\전기CBT\out_img\전기기사20190804(교사용)_p08_q006.png
7,무한장 직선형 도선에 I(A)의 전류가 흐를 경우 도선으로부 터 R(m) 떨어진 점의 자속밀도 B(Wb/m2)는?,,,,,1,image,C:\전기CBT\out_img\전기기사20190804(교사용)_p08_q007.png
8,"전하 q(C)가 진공 중의 자계 H(AT/m)에 수직방향으로 v(m/s)의 속도로 움직일 때 받는 힘은 몇 N인가? (단, 진 공 중의 투자율은 μ 이다.) o",qvH,μ qH o,πqvH,μ qvH o,4,text,
9,원통 좌표계에서 일반적으로 벡터가 A = 5r sinøa 로 표현 z 될 때 점 에서 curlA를 구하면?,5a,5πa r ø,-5a,-5πa ø ø,3,text,
10,전기 저항에 대한 설명으로 틀린 것은?,저항의 단위는 옴(Ω)을 사용한다.,저항률(ρ)의 역수를 도전율이라고 한다.,금속선의 저항 R은 길이 ℓ에 반비례한다.,전류가 흐르고 있는 금속선에 있어서 임의 두 점간의 전위차는 전류에 비례한다.,3,text,
11,자계의 벡터포텐셜을 A라 할 때 자계의 시간적 변화에 의 하여 생기는 전계의 세기 E는?,E = rot A,rot E = A,,,3,image,C:\전기CBT\out_img\전기기사20190804(교사용)_p08_q011.png
12,"환상철심의 평균 자계의 세기가 3000AT/m이고, 비투자율 이 600인 철심 중의 자화의 세기는 약 몇 Wb/m2 인가?",0.75,2.26,4.52,9.04,2,text,
13,"평행판 콘덴서의 극간 전압이 일정한 상태에서 극간에 공 기가 있을 때의 흡인력을 F , 극판 사이에 극판 간격의",,,,,4,image,C:\전기CBT\out_img\전기기사20190804(교사용)_p08_q013.png
14,전자파의 특성에 대한 설명으로 틀린 것은?,전자파의 속도는 주파수와 무관하다.,전파 E 를 고유임피던스로 나누면 자파 H 가 된다. x y,전파 E 와 자파 H 의 진동방향은 진행 방향에 수평인 x y 종파이다.,매질이 도전성을 갖지 않으면 전파 E 와 자파 H 는 동 x y 위상이 된다.,3,text,
15,"진공 중에서 점 P(1, 2, 3) 및 점 Q(2, 0, 5)에 각각 300μ C, -100μC인 점전하가 놓여 있을 때 점전하 -100μC에 작용하는 힘은 몇 N인가?",10i – 20j + 20k,10i + 20j - 20k,-10i + 20j + 20k,-10i + 20j - 20k,4,text,
16,반지름 a(m)의 구 도체에 전하 Q(C)가 주어질 때 구 도체 표면에 작용하는 정전응력은 몇 N/m2인가?,,,,,4,image,C:\전기CBT\out_img\전기기사20190804(교사용)_p08_q016.png
17,"정전용량이 각각 C , C , 그 사이의 상호 유도계수가 M인",,,,,3,image,C:\전기CBT\out_img\전기기사20190804(교사용)_p08_q017.png
18,"길이 ℓ(m)인 동축 원통 도체의 내외원통에 각각 +λ, -λ (C/m)의 전하가 분포되어 있다. 내외원통 사이에 유전율 ε인 유전체가 채워져 있을 때, 전계의 세기(V/m)은? (단, V는 내외원통 간의 전위차, D는 전속밀도이고, a, b는 내 외원통의 반지름이며, 원통 중심에서의 거리 r은 a ＜ r ＜ b인 경우이다.)",,,,,1,image,C:\전기CBT\out_img\전기기사20190804(교사용)_p08_q018.png
19,"정전용량이 1μF 이고 판의 간격이 d인 공기콘덴서가 있 다. 두께 , 비유전율 ε =2 유전체를 그 콘덴서의 r 한 전극면에 접촉하여 넣었을 때 전체의 정전용량(μF)은?",2,1/2,4/3,5/3,3,text,
20,변위전류와 가장 관계가 깊은 것은?,도체,반도체,유전체,자성체 2과목 : 전력공학,3,text,
21,"역률 80%, 500kVA의 부하설비에 100kVA의 진상용 콘덴 서를 설치하여 역률을 개선하면 수전점에서의 부하는 약 몇 kVA가 되는가?",400,425,450,475,3,text,
22,가공지선에 대한 설명 중 틀린 것은?,유도뢰 서지에 대하여도 그 가설구간 전체에 사고방지 의 효과가 있다.,직격뢰에 대하여 특히 유효하며 탑 상부에 시설하므로 뇌는 주로 가공지선에 내습한다.,송전선의 1선 지락 시 지락전류의 일부가 가공지선에 흘러 차폐작용을 하므로 전자유도장해를 적게 할 수 있다.,가공지선 때문에 송전선로의 대지정전용량이 감소하므 로 대지사이에 방전할 때 유도전압이 특히 커서 차폐 효과가 좋다.,4,text,
23,부하전류의 차단에 사용되지 않는 것은?,DS,ACB,OCB,VCB,1,text,
24,플리커 경감을 위한 전력 공급측의 방안이 아닌 것은?,공급전압을 낮춘다.,전용 변압기로 공급한다.,단독 공급계통을 구성한다.,단락용량이 큰 계통에서 공급한다.,1,text,
25,"3상 무부하 발전기의 1선 지락 고장 시에 흐르는 지락 전 류는? (단, E는 접지된 상의 무부하 기전력이고, Z , Z ,",,,,,3,image,C:\전기CBT\out_img\전기기사20190804(교사용)_p08_q025.png
26,수력발전소의 분류 중 낙차를 얻는 방법에 의한 분류 방법 이 아닌 것은?,댐식 발전소,수로식 발전소,양수식 발전소,유역 변경식 발전소,3,text,
27,변성기의 정격부담을 표시하는 단위는?,W,S,dyne,VA,4,image,C:\전기CBT\out_img\전기기사20190804(교사용)_p08_q027.png
28,원자로에서 중성자가 원자로 외부로 유출되어 인체에 위험 을 주는 것을 방지하고 방열의 효과를 주기 위한 것은?,제어재,차폐재,반사체,구조재,2,text,
29,연가에 의한 효과가 아닌 것은?,직렬공진의 방지,대지정전용량의 감소,통신선의 유도장해 감소,선로정수의 평형,2,text,
30,각 전력계통을 연계선으로 상호 연결하였을 때 장점으로 틀린 것은?,건설비 및 운전경비를 절감하므로 경제급전이 용이하 다.,주파수의 변화가 작아진다.,각 전력계통의 신뢰도가 증가된다.,선로 임피던스가 증가되어 단락전류가 감소된다.,4,text,
31,전압요소가 필요한 계전기가 아닌 것은?,주파수 계전기,동기탈조 계전기,지락 과전류 계전기,방향성 지락 과전류 계전기,3,text,
32,수력발전설비에서 흡출관을 사용하는 목적으로 옳은 것은?,압력을 줄이기 위하여,유효낙차를 늘리기 위하여,속도변동률을 적게 하기 위하여 전기기사 2019년 08월 04일 필기 기출문제,물의 유선을 일정하게 하기 위하여,2,text,
33,인터록(interlock)의 기능에 대한 설명으로 옳은 것은??,조작자의 의중에 따라 개폐되어야 한다.,차단기가 열려 있어야 단로기를 닫을 수 있다.,차단기가 닫혀 있어야 단로기를 닫을 수 있다.,"차단기와 단로기를 별도로 닫고, 열 수 있어야 한다.",2,text,
34,같은 선로와 같은 부하에서 교류 단상 3선식은 단상 2선 식에 비하여 전압강하와 배전효율이 어떻게 되는가?,"전압강하는 적고, 배전효율은 높다.","전압강하는 크고, 배전효율은 낮다.","전압강하는 적고, 배전효율은 낮다.","전압강하는 크고, 배전효율은 높다.",1,text,
35,전력 원선도에서는 알 수 없는 것은?,송수전할 수 있는 최대전력,선로 손실,수전단 역률,코로나손,4,image,C:\전기CBT\out_img\전기기사20190804(교사용)_p08_q035.png
36,가공선 계통은 지중선 계통보다 인덕턴스 및 정전용량이 어떠한가?,"인덕턴스, 정전용량이 모두 작다.","인덕턴스, 정전용량이 모두 크다.","인덕턴스는 크고, 정전용량은 작다.","인덕턴스는 작고, 정전용량은 크다.",3,text,
37,"송전선의 특성임피던스는 저항과 누설 컨덕턴스를 무시하 면 어떻게 표현되는가? (단, L은 선로의 인덕턴스, C는 선 로의 정전용량이다.)",,,,,1,image,C:\전기CBT\out_img\전기기사20190804(교사용)_p08_q037.png
38,다음 중 송전선로의 코로나 임계전압이 높아지는 경우가 아닌 것은?,날씨가 맑다.,기압이 높다,상대공기밀도가 낮다.,전선의 반지름과 선간거리가 크다.,3,text,
39,"어느 수용가의 부하설비는 전등설비가 500W, 전열설비가 600W, 전동기 설비가 400W, 기타설비가 100W 이다. 이 수용가의 최대수용전력이 1200W이면 수용률은 몇 %인 가?",55,65,75,85,3,image,C:\전기CBT\out_img\전기기사20190804(교사용)_p08_q039.png
40,케이블의 전력 손실과 관계가 없는 것은?,철손,유전체손,시스손,도체의 저항손 3과목 : 전기기기,1,text,
41,동기발전기의 돌발 단락 시 발생되는 현상으로 틀린 것은?,큰 과도전류가 흘러 권선 소손,단락전류는 전기자 저항으로 제한,코일 상호간 큰 전자력에 의한 코일 파손,큰 단락전류 후 점차 감소하여 지속 단락전류 유지,2,text,
42,SCR의 특징으로 틀린 것은?,과전압에 약하다..,열용량이 적어 고온에 약하다.,전류가 흐르고 있을 때의 양극 전압강하가 크다.,게이트에 신호를 인가할 때부터 도통할 때까지의 시간 이 짧다.,3,text,
43,터빈 발전기의 냉각을 수소냉각방식으로 하는 이유로 틀린 것은?,풍손이 공기 냉각 시의 양 1/10로 줄어든다.,열전도율이 좋고 가스냉각기의 크기가 작아진다.,절연물의 산화작용이 없으므로 절연열화가 작아서 수명 이 길다.,반폐형으로 하기 때문에 이물질의 침입이 없고 소음이 감소한다.,4,text,
44,단상 유도전동기의 특징을 설명한 것으로 옳은 것은?,기동 토크가 없으므로 기동장치가 필요하다.,기계손이 있어도 무부하 속도는 동기속도보다 크다.,"권선형은 비례추이가 불가능하며, 최대 토크는 불변이 다.","슬립은 0＞S＞-1 이고, 2보다 작고 0이 되기 전에 토 크가 0이 된다.",1,text,
45,몰드변압기의 특징으로 틀린 것은?(문제 오류로 가답안 발 표시 4번으로 발표되었지만 확정답안 발표시 모두 정답처 리 되었습니다. 여기서는 가답안인 4번을 누르면 정답 처 리 됩니다.),자기 소화성이 우수하다.,소형 경량화가 가능하다.,건식변압기에 비해 소음이 적다.,유입변압기에 비해 절연레벨이 낮다.,4,text,
46,"유도전동기의 회전속도를 N(rpm), 동기속도를 Ns(rpm)이 라하고 순방향 회전자계의 슬립을 s라고 하면, 역방향 회 전자계에 대한 회전자 슬립은?",s-1,1-s,s-2,2-s,4,text,
47,"직류발전기에 직결한 3상 유도전동기가 있다. 발전기의 부 하 100kW, 효율 90%이며 전동기 단자전압 3300V, 효율 90%, 역률 90%이다. 전동기에 흘러들어가는 전류는 약 몇 A인가?",2.4,4.8,19,24,4,text,
48,유도발전기의 동작특성에 관한 설명 중 틀린 것은?,병렬로 접속된 동기발전기에서 여자를 취해야 한다.,효율과 역률이 낮으며 소출력의 자동수력발전기와 같은 용도에 사용된다. 전기기사 2019년 08월 04일 필기 기출문제,유도발전기의 주파수를 증가하려면 회전속도를 동기속 도 이상으로 회전시켜야 한다.,선로에 단락이 생긴 경우에는 여자가 상실되므로 단락 전류는 동기발전기에 비해 적고 지속시간도 짧다.,3,text,
49,단상 변압기를 병렬 운전하는 경우 각 변압기의 부하분담 이 변압기의 용량에 비례하려면 각각의 변압기의 %임피던 스는 어느 것에 해당되는가?,어떠한 값이라도 좋다.,변압기 용량에 비례하여야 한다.,변압기 용량에 반비례하여야 한다.,변압기 용량에 관계없이 같아야 한다.,3,text,
50,그림은 여러 직류전동기의 속도 특성곡선을 나타낸 것이 다. 1부터 4까지 차례로 옳은 것은?,"차동복권, 분권, 가동복권, 직권","직권, 가동복권, 분권, 차동복권","가동복권, 차동복권, 직권, 분권","분권, 직권, 가동복권, 차동복권",2,text,
51,전력변환기기로 틀린 것은?,컨버터,정류기,인버터,유도전동기,4,text,
52,농형 유도전동기에 주로 사용되는 속도제어법은?,극수 변환법,종속 접속법,2차 저항제어법,2차 여자제어법,1,text,
53,"정격전압 100V, 정격전류 50A인 분권발전기의 유기기전력 은 몇 V 인가? (단, 전기자 저항 0.2Ω, 계자전류 및 전기 자 반작용은 무시한다.)",110,120,125,127.5,1,text,
54,그림과 같은 변압기 회로에서 부하 R 에 공급되는 전력이,,,,,2,image,C:\전기CBT\out_img\전기기사20190804(교사용)_p08_q054.png
55,"변압기의 백분율 저항강하가 3%, 백분율 리액턴스 강하가 4%일 때 뒤진 역률 80%인 경우의 전압변동률(%)은?",2.5,3.4,4.8,-3.6,3,text,
56,정류자형 주파수변환기의 회전자에 주파수 f 의 교류를 가,,,,,4,image,C:\전기CBT\out_img\전기기사20190804(교사용)_p08_q056.png
57,동기발전기의 3상 단락곡선에서 단락전류가 계자전류에 비 례하여 거의 직선이 되는 이유로 가장 옳은 것은?,무부하 상태이므로,전기자 반작용으로,자기포화가 있으므로,누설 리액턴스가 크므로,2,text,
58,"1차 전압 V , 2차 전압 V 인 단권변압기를 Y결선했을 때,",,,,,2,image,C:\전기CBT\out_img\전기기사20190804(교사용)_p08_q058.png
59,변압기의 보호에 사용되지 않는 것은?,온도계전기,과전류계전기,임피던스계전기,비율차등계전기,3,text,
60,"E를 전압, r을 1차로 환산한 저항, χ를 1차로 환산한 리액 터스라고 할 때 유도전동기의 원선도에서 원의 지름을 나 타내는 것은?",E·r,E·χ,E/x,E/r 4과목 : 회로이론 및 제어공학,3,text,
61,그림의 벡터 궤적을 갖는 계의 주파수 전달함수는? 전기기사 2019년 08월 04일 필기 기출문제,,,,,4,image,C:\전기CBT\out_img\전기기사20190804(교사용)_p08_q061.png
62,근궤적에 관한 설명으로 틀린 것은?,근궤적은 실수축에 대하여 상하 대칭으로 나타난다.,근궤적의 출발점은 극점이고 근궤적의 도착점은 영점이 다.,근궤적의 가지 수는 극점의 수와 영점의 수 중에서 큰 수와 같다.,근궤적이 s 평면의 우반면에 위치하는 K의 범위는 시 스템이 안정하기 위한 조건이다.,4,text,
63,"제어시스템에서 출력이 얼마나 목표값을 잘 추종하는지를 알아볼 때, 시험용으로 많이 사용되는 신호로 다음 식의 조건을 만족하는 것은?",사인함수,임펄스함수,램프함수,단위계단함수,4,text,
64,특성방적식 s2+Ks+2K-1=0 인 계가 안정하기 위한 K의 범 위는?,,,,,2,image,C:\전기CBT\out_img\전기기사20190804(교사용)_p08_q064.png
65,"상태공간 표현식 로 표현되는 선형 시 스템에서 , , C = [1 0 0], D = 0, 이면 시스템 전달함수 는?",,,,,3,image,C:\전기CBT\out_img\전기기사20190804(교사용)_p08_q065.png
66,Routh-Hurwitz 표에서 제 1열의 부호가 변하는 횟수로부 터 알 수 있는 것은?,s-평면의 좌반면에 존재하는 근의 수,s-평면의 우반면에 존재하는 근의 수,s-평면의 허수축에 존재하는 근의 수,s-평면의 원점에 존재하는 근의 수,2,text,
67,그림의 블록선도에 대한 전달함수 C/R는?,,,,,3,image,C:\전기CBT\out_img\전기기사20190804(교사용)_p08_q067.png
68,신호흐름선도의 전달함수 로 옳은 것 은?,,전기기사 2019년 08월 04일 필기 기출문제,,,2,image,C:\전기CBT\out_img\전기기사20190804(교사용)_p08_q068.png
69,부울 대수식 중 틀린 것은?,,A + 1 = 1,A + A = A,A · A = A,1,text,
70,함수 e-at의 z 변환으로 옳은 것은?,,,,,1,image,C:\전기CBT\out_img\전기기사20190804(교사용)_p08_q070.png
71,"4단자 회로망에서 4단자 정수가 A, B, C, D일 때, 영상 임피던스 은?",,,,,4,image,C:\전기CBT\out_img\전기기사20190804(교사용)_p08_q071.png
72,"RL 직렬회로에서 R=20Ω, L=40mH일 때, 이 회로의 시정 수(sec)는?",2 × 103,2 × 10-3,,,2,image,C:\전기CBT\out_img\전기기사20190804(교사용)_p08_q072.png
73,"비정현파 전류가 i(t) = 56sinωt + 20sin2ωt + 30sin(3ωt+ 30°) + 40sin(4ωt + 60°)로 표현될 때, 왜형률은 약 얼마 인가?",1.0,0.96,0.55,0.11,2,text,
74,"대칭 6상 성형(star)결선에서 선간전압 크기와 상전압 크기 의 관계로 옳은 것은? (단, V : 선간전압 크기, V : 상전 l p 압 크기)",,,,,1,image,C:\전기CBT\out_img\전기기사20190804(교사용)_p08_q074.png
75,"3상 불평형 전압 V , V , V 가 주어진다면, 정상분 전압은? a b c (단, a = ej2π/3 = 1∠120° 이다.)",V + a2V + aV a b c,V + aV + a2V a b c,(V + a2V + aV ) a b c,(V + aV + a2V ) a b c,4,text,
76,"송전선로가 무손실 선로일 때, L=96mH 이고 C=0.6μF 이 면 특성임피던스(Ω)는?",100,200,400,600,3,text,
77,커페시터와 인덕터에서 물리적으로 급격히 변화할 수 없는 것은?,커페시터와 인덕터에서 모두 전압,커페시터와 인덕터에서 모두 전류,"커페시터에서 전류, 인덕터에서 전압","커페시터에서 전압, 인덕터에서 전류",4,text,
78,"2전력계법을 이용한 평형 3상회로의 전력이 각각 500W 및 300W로 측정되었을 때, 부하의 역률은 약 몇 % 인가?",70.7,87.7,89.2,91.8,4,image,C:\전기CBT\out_img\전기기사20190804(교사용)_p08_q078.png
79,"인덕턴스가 0.1H인 코일에 실효값 100V, 60Hz, 위상 30 도인 전압을 가했을 때 흐르는 전류의 실효값 크기는 약 몇 A 인가?",43.7,37.7,5.46,2.65,4,text,
80,f(t) = δ(t – T)의 라플라스변환 F(s)는?,eTs,e-Ts,,5과목 : 전기설비기술기준 및 판단기준,2,text,
